{
 "meta": {
  "schema_version": 4,
  "title": "Acme 리더 멘탈모델 온톨로지 (샘플)",
  "org": "Acme",
  "subtitle": "가상의 구독 커머스 스타트업 Acme의 5~6월 전략·가격 회의 2건에서 리더들의 사고방식을 재구성한 예시 데이터.",
  "date_range": "2026-05-20 ~ 2026-06-24",
  "sensitivity": "L2",
  "confidence_note": "이 파일은 도구 시연용 가상 데이터입니다. 실제 인물·조직과 무관합니다. 인용문도 예시입니다.",
  "sources": [
   "2026-05-20 Acme 전략 회의 (녹취)",
   "2026-06-24 Acme 가격정책 회의 (녹취)"
  ],
  "processed_source_ids": [
   "acme-rec-0520",
   "acme-rec-0624"
  ]
 },
 "meetings": [
  {
   "id": "m1",
   "date": "2026-05-20",
   "title": "전략 회의 — 다음 분기 방향",
   "source_id": "acme-rec-0520",
   "path": "transcripts/2026/2026-05/2026-05-20_전략회의-다음분기.md"
  },
  {
   "id": "m2",
   "date": "2026-06-24",
   "title": "가격정책 회의 — 구독료 인상 여부",
   "source_id": "acme-rec-0624",
   "path": "transcripts/2026/2026-06/2026-06-24_가격정책-인상여부.md"
  }
 ],
 "people": [
  {
   "name": "정우진",
   "type": "person",
   "role": "CEO",
   "org": "Acme",
   "summary": "시장에 먼저 신호를 던지고 반응으로 배우려는 속도 지향 창업자. 완성도보다 학습 속도를 우선하며, 팀이 스스로 답을 찾게 질문으로 이끈다.",
   "evidence": "high",
   "models": [
    "speed-over-polish",
    "declare-to-learn",
    "question-led"
   ],
   "evolution": [
    {
     "date": "2026-05-20",
     "note": "무조건 빠른 인상 공표를 주장."
    },
    {
     "date": "2026-06-24",
     "note": "이탈 데이터 보고 '단계적 인상'으로 톤 조정 — 속도 지향은 유지하되 리스크 수용."
    }
   ],
   "playbook": "결론을 주지 말고 데이터를 먼저 보여줘라 — 이탈 수치 하나가 30분 설득보다 빨랐다. 속도 자체를 막지 말고 '더 빨리 배우는 방법'으로 프레이밍하면 수용한다."
  },
  {
   "name": "이서연",
   "type": "person",
   "role": "CPO",
   "org": "Acme",
   "summary": "제품 완성도를 신뢰의 전제로 보는 프로덕트 리더. 차별 기능 없이 가격을 올리면 신뢰가 깨진다고 보고, 사용자 가치가 선행돼야 한다고 주장한다.",
   "evidence": "high",
   "models": [
    "value-before-price",
    "trust-is-fragile"
   ],
   "evolution": [
    {
     "date": "2026-06-24",
     "note": "'번들 기능 먼저 출시 후 인상' 절충안을 제시하며 CEO와 접점 형성."
    }
   ],
   "playbook": "'언제 올리냐'가 아니라 '무엇을 먼저 주냐'로 질문을 바꿔라. 가치 선행이 보장되면 속도에도 협조적이다."
  },
  {
   "name": "박도현",
   "type": "person",
   "role": "CFO",
   "org": "Acme",
   "summary": "현금흐름과 런웨이를 판단의 축으로 두는 보수적 재무 리더. 성장도 현금 건전성 안에서만 유효하다고 본다.",
   "evidence": "mid",
   "models": [
    "runway-first",
    "growth-within-cash",
    "investor-discipline-lens"
   ],
   "playbook": "모든 제안에 런웨이 영향을 한 줄 붙여라. 숫자가 있으면 보수성이 협상 가능해진다."
  },
  {
   "name": "김하늘",
   "type": "person",
   "role": "영업총괄",
   "org": "Acme",
   "summary": "기존 고객 이탈을 최우선 리스크로 보는 신중론자. 채널·리텐션 관점에서 급격한 변화에 브레이크를 건다.",
   "evidence": "mid",
   "models": [
    "churn-first",
    "retention-moat"
   ],
   "playbook": "현장의 언어('배신감')를 데이터로 번역해주면 가장 강력한 아군이 된다."
  },
  {
   "name": "최민석",
   "type": "person",
   "role": "CTO",
   "org": "Acme",
   "summary": "실험 인프라로 의사결정을 대체하려는 기술 리더. '논쟁 대신 A/B로 확인하자'는 데이터 우선 관점.",
   "evidence": "mid",
   "models": [
    "experiment-over-debate"
   ],
   "playbook": "논쟁이 길어지면 실험 설계를 맡겨라 — '2주면 답 나온다'가 이 사람의 해결 문법이다."
  },
  {
   "name": "그로우캐피탈",
   "type": "org",
   "role": "시리즈B 리드 투자사",
   "summary": "Acme의 리드 투자사. 리더들의 발언에서 '성장률만큼 소진 규율을 본다'는 상(像)으로 등장 — 투자사 자신의 발언이 아니므로 추정(mid) 이상으로 올리지 않는다.",
   "evidence": "mid",
   "models": []
  }
 ],
 "models": [
  {
   "id": "speed-over-polish",
   "category": "전략",
   "title": "완성도보다 학습 속도가 먼저다",
   "desc": "완벽히 다듬기보다 빠르게 내보내 시장 반응으로 배운다. 속도가 곧 정보다.",
   "evidence": "high",
   "holders": [
    "정우진"
   ],
   "quote": "다 갖추고 내면 이미 늦어요. 일단 던지고 반응 보고 고치는 게 정보가 제일 빨라요.",
   "count": 2,
   "first_seen": "2026-05-20",
   "last_seen": "2026-06-24",
   "related": [
    "declare-to-learn"
   ],
   "evidence_type": "direct"
  },
  {
   "id": "declare-to-learn",
   "category": "제품",
   "title": "선언이 곧 학습 장치다",
   "desc": "가격 인상을 먼저 공표해 내부 리소스를 모으고 고객 반응을 조기에 확인한다.",
   "evidence": "high",
   "holders": [
    "정우진"
   ],
   "quote": "인상한다고 먼저 말해두면 팀이 거기에 맞춰 움직이고, 나갈 사람은 지금 갈려요.",
   "count": 1,
   "first_seen": "2026-05-20",
   "related": [
    "speed-over-polish",
    "value-before-price"
   ],
   "evidence_type": "direct"
  },
  {
   "id": "question-led",
   "category": "조직",
   "title": "답을 주지 않고 질문으로 이끈다",
   "desc": "결론을 박지 않고 질문을 던져 리더들이 스스로 패턴을 찾게 한다.",
   "evidence": "high",
   "holders": [
    "정우진"
   ],
   "quote": "제가 정답을 말하면 다들 거기서 멈춰요. 그래서 '그럼 이건 어떻게 될까요' 하고 되묻죠.",
   "count": 1,
   "first_seen": "2026-05-20",
   "evidence_type": "direct"
  },
  {
   "id": "value-before-price",
   "category": "제품",
   "title": "가치가 가격보다 먼저다",
   "desc": "차별 기능·사용자 가치가 선행되지 않으면 인상은 신뢰를 깬다. 번들 기능 출시 후 과금해야 설득력이 있다.",
   "evidence": "high",
   "holders": [
    "이서연"
   ],
   "quote": "지금 올리면 '뭐가 좋아졌는데?' 소리 들어요. 줄 걸 먼저 주고 받아야죠.",
   "count": 2,
   "first_seen": "2026-05-20",
   "last_seen": "2026-06-24",
   "related": [
    "trust-is-fragile",
    "declare-to-learn"
   ],
   "evidence_type": "direct"
  },
  {
   "id": "trust-is-fragile",
   "category": "제품",
   "title": "신뢰는 깨지기 쉽다",
   "desc": "한 번 잃은 구독자 신뢰는 회복이 비싸다. 변화는 신뢰 예산 안에서 집행한다.",
   "evidence": "mid",
   "holders": [
    "이서연"
   ],
   "count": 1,
   "first_seen": "2026-05-20",
   "related": [
    "churn-first"
   ],
   "evidence_type": "direct"
  },
  {
   "id": "runway-first",
   "category": "재무",
   "title": "런웨이가 모든 결정의 상한이다",
   "desc": "현금 소진 속도가 전략의 경계. 성장도 런웨이 안에서만 유효하다.",
   "evidence": "mid",
   "holders": [
    "박도현"
   ],
   "quote": "재밌는 실험 다 좋은데, 우리 통장이 14개월이에요. 거기서 시작해요.",
   "count": 1,
   "first_seen": "2026-05-20",
   "related": [
    "growth-within-cash"
   ],
   "evidence_type": "direct"
  },
  {
   "id": "growth-within-cash",
   "category": "재무",
   "title": "현금 건전성 안에서만 성장한다",
   "desc": "성장률보다 현금 회수 주기를 먼저 본다. 인상은 현금흐름 개선 카드로도 유효.",
   "evidence": "mid",
   "holders": [
    "박도현"
   ],
   "count": 1,
   "first_seen": "2026-06-24",
   "related": [
    "runway-first"
   ],
   "evidence_type": "direct"
  },
  {
   "id": "investor-discipline-lens",
   "category": "투자",
   "title": "투자자는 성장률만큼 소진 규율을 본다",
   "desc": "다음 라운드 관점에서 번레이트 규율이 성장 스토리의 신뢰도를 좌우한다고 본다. 그로우캐피탈에 '대한' 박도현의 믿음 — 투자사 자신의 발언이 아니므로 mid.",
   "evidence": "mid",
   "holders": [
    "박도현"
   ],
   "about": [
    "그로우캐피탈"
   ],
   "quote": "그로우 쪽은 미팅 열면 우리 소진 곡선부터 물어볼 거예요.",
   "count": 1,
   "first_seen": "2026-06-24",
   "related": [
    "runway-first"
   ],
   "evidence_type": "hearsay"
  },
  {
   "id": "churn-first",
   "category": "리스크",
   "title": "이탈을 최우선으로 본다",
   "desc": "급격한 가격 변화는 기존 고객 이탈로 직결된다. 영향 최소 범위에서 단계적으로.",
   "evidence": "mid",
   "holders": [
    "김하늘"
   ],
   "quote": "숫자로만 보면 인상이 맞는데, 현장은 '배신감'이라고 말해요. 그게 이탈이에요.",
   "count": 1,
   "first_seen": "2026-06-24",
   "related": [
    "retention-moat",
    "trust-is-fragile"
   ],
   "evidence_type": "direct"
  },
  {
   "id": "retention-moat",
   "category": "전략",
   "title": "리텐션이 진짜 해자다",
   "desc": "신규 획득보다 재구독율이 방어벽. 가격은 리텐션을 해치지 않는 선에서 조정.",
   "evidence": "mid",
   "holders": [
    "김하늘"
   ],
   "count": 1,
   "first_seen": "2026-06-24",
   "evidence_type": "direct"
  },
  {
   "id": "experiment-over-debate",
   "category": "기술",
   "title": "논쟁 대신 실험으로 결정한다",
   "desc": "의견 충돌은 A/B 테스트로 푼다. 인상폭도 코호트 실험으로 검증 후 확정.",
   "evidence": "mid",
   "holders": [
    "최민석"
   ],
   "quote": "이거 회의로 30분 싸울 게 아니라, 두 그룹 나눠서 2주면 답 나와요.",
   "count": 1,
   "first_seen": "2026-06-24",
   "evidence_type": "direct"
  }
 ],
 "network": [
  {
   "a": "이서연",
   "b": "정우진",
   "kind": "소개",
   "since": "2024-11-01",
   "note": "SaaS 밋업에서 이서연이 정우진을 투자자들에게 소개."
  },
  {
   "a": "박도현",
   "b": "그로우캐피탈",
   "kind": "투자",
   "since": "2025-08-01",
   "note": "시리즈B 리드 — 박도현이 창구."
  }
 ],
 "relations": [
  {
   "from": "정우진",
   "to": "이서연",
   "type": "tension",
   "topic": "인상 타이밍",
   "note": "CEO(선언 먼저) vs CPO(가치 먼저) — 핵심 대립."
  },
  {
   "from": "이서연",
   "to": "김하늘",
   "type": "agree",
   "topic": "신뢰·이탈",
   "note": "둘 다 급격한 변화의 신뢰 훼손을 경계."
  },
  {
   "from": "박도현",
   "to": "정우진",
   "type": "builds-on",
   "topic": "인상=현금 카드",
   "note": "CFO가 CEO의 인상론에 '현금흐름 개선' 논거를 더함."
  },
  {
   "from": "최민석",
   "to": "정우진",
   "type": "builds-on",
   "topic": "실험으로 속도내기",
   "note": "CTO가 CEO의 속도론을 A/B 실험 방법론으로 구체화."
  },
  {
   "from": "김하늘",
   "to": "박도현",
   "type": "tension",
   "topic": "성장 vs 이탈",
   "note": "재무는 인상 찬성 쪽, 영업은 이탈 우려로 신중.",
   "direction": "one-way"
  }
 ],
 "bets": [
  {
   "tag": "monetize",
   "title": "구독료 단계적 인상",
   "desc": "번들 기능 출시와 묶어 2단계로 인상, 코호트 A/B로 폭 검증.",
   "status": "검토중",
   "owner": "정우진",
   "date": "2026-06-24",
   "source": [
    "2026-06-24"
   ]
  },
  {
   "tag": "product",
   "title": "번들 기능 선출시",
   "desc": "인상 전 차별 기능을 먼저 제공해 '가치→가격' 순서 확보.",
   "status": "진행중",
   "owner": "이서연",
   "date": "2026-06-24",
   "source": [
    "2026-06-24"
   ]
  },
  {
   "tag": "platform",
   "title": "가격 실험 인프라",
   "desc": "코호트 분리·과금 실험을 상시 돌릴 수 있는 실험 플랫폼.",
   "status": "검토중",
   "owner": "최민석",
   "date": "2026-05-20",
   "source": [
    "2026-06-24"
   ]
  }
 ],
 "risks": [
  {
   "level": "high",
   "title": "인상 타이밍 미결",
   "desc": "CEO(선언 먼저) vs CPO(가치 먼저) 이견이 미결 — 정렬 지체 시 실행 혼선.",
   "status": "관찰중"
  },
  {
   "level": "high",
   "title": "기존 구독자 이탈",
   "desc": "차별 가치 없이 인상하면 리텐션 하락으로 직결.",
   "status": "완화중",
   "mitigation": "번들 기능 선출시로 가치 선행 확보"
  },
  {
   "level": "mid",
   "title": "런웨이 압박",
   "desc": "현금 14개월 — 실험 기간이 길면 재무 여유 감소.",
   "status": "관찰중"
  }
 ],
 "timeline": [
  {
   "date": "2026-05-20",
   "meeting": "m1",
   "change": "CEO 주도로 '빠른 인상' 방향 제시, CPO·영업 신중론 대립."
  },
  {
   "date": "2026-06-24",
   "meeting": "m2",
   "change": "이탈 데이터 확인 후 '번들 선출시 + 단계적 인상 + A/B 검증'으로 팀 절충안 수렴."
  }
 ],
 "conflict_axes": [
  {
   "a": "정우진",
   "b": "이서연",
   "axis": "가격 인상의 순서 — 선언 먼저 vs 가치 먼저",
   "shared_axiom": "구독자의 생애가치(LTV)가 회사의 전부다 — 인상 자체에는 둘 다 동의",
   "a_side": "선언이 학습 장치 — 먼저 공표해 리소스를 모으고 시장 반응으로 배운다",
   "b_side": "가치가 신뢰의 전제 — 번들 기능을 먼저 주고 받아야 신뢰가 유지된다",
   "note": "6/24 회의에서 '번들 선출시 + 단계적 인상 + A/B 검증' 절충으로 수렴 — 축은 남아 다음 결정에서 재등장 예상",
   "evidence_type": "direct"
  },
  {
   "a": "박도현",
   "b": "김하늘",
   "axis": "인상의 평가 기준 — 현금흐름 vs 이탈",
   "shared_axiom": "급격한 변화는 위험하다 (둘 다 단계적 접근 지지)",
   "a_side": "인상 = 런웨이를 늘리는 현금 카드",